{
 "title": "AI-native company (v2026-10)",
 "plan": {"intent": "AI 네이티브 회사에서 문제 하나가 사람과 에이전트를 거쳐 판으로 나가기까지 누가 무엇을 맡는가"},
 "types": {
  "User": "회사의 사람 한 명입니다.",
  "Release": "고객에게 나가는 판 하나입니다.",
  "WorkKind": "{specification, decision, pullRequest, document} 작업 기록의 종류입니다. 명세, 결정, 풀 리퀘스트, 문서로 나눕니다.",
  "SignalKind": "{ticket, usage, transaction} 고객 신호가 온 곳입니다. 문의, 사용 기록, 결제로 나눕니다.",
  "PermissionRule": "{allow, ask, deny} 도구 하나에 대한 권한 규칙입니다. 그냥 허용, 물어본 뒤 허용, 금지로 나눕니다.",
  "AgentRun": "에이전트가 맡은 일 하나를 처음부터 끝까지 수행하는 실행 한 번입니다."
 },
 "scenarios": [
  {
   "slug": "solve-customer-problem",
   "text": "고객 신호에서 문제가 드러나면, 사람이 그 문제를 명세와 시나리오로 적고, 에이전트가 계획하고 구현하고 검토하고 검증한 판을 사람이 써 보고 판정해 고객에게 내보냅니다.",
   "walk": [
    {
     "place": ["customers", "brain"],
     "does": "고객의 실제 사용과 문의가 신호가 되어 Company brain에 쌓이면서 이야기가 시작됩니다.",
     "expects": "고객이 남긴 신호가 출처와 볼 수 있는 범위와 함께 회사의 기억에 들어 있습니다."
    },
    {
     "place": ["signal", "problem"],
     "does": "Company brain 안으로 들어가, 쌓인 신호 가운데 기존 기능으로 풀리지 않는 것이 새 Problem이 되는 모습을 봅니다.",
     "expects": "새 문제는 정해 둔 로드맵이 아니라 고객 신호에서 나온 것으로 기억에 남아 있습니다."
    },
    {
     "place": ["brain", "builders", "factory"],
     "does": "다시 회사 전체로 나와, 드러난 문제가 Builders에게 보이고 사람이 그것을 명세와 시나리오로 적어 Software factory에 넘깁니다.",
     "expects": "공장에는 이 고객 문제에서 나온 일감이 맡겨져 있고, 무엇을 만족해야 하는지 사람이 정해 두었습니다."
    },
    {
     "place": "spec",
     "does": "Software factory 안을 열면, 에이전트가 사람을 인터뷰해 명세를 쓰고 사람은 만족해야 할 시나리오를 적습니다.",
     "expects": "명세와 시나리오가 따로 마련되어, 명세는 계획으로 가고 시나리오는 검증 쪽으로 갈 준비가 되어 있습니다."
    },
    {
     "place": "plan",
     "does": "명세를 넘겨받은 에이전트가 코드를 둘러보고 무엇을 어떻게 바꿀지 계획을 세웁니다.",
     "expects": "사람이 맞는지 볼 수 있는 계획이 나와 있고, 그 안에 판정용 시나리오는 들어 있지 않습니다."
    },
    {
     "place": "impl",
     "does": "여러 에이전트가 계획을 나눠 각자의 작업 공간에서 동시에 구현하고 하나의 변경으로 모읍니다.",
     "expects": "병렬로 만든 결과가 하나의 변경으로 합쳐져 검토로 넘어갈 수 있습니다."
    },
    {
     "place": "review",
     "does": "구현한 세션과 다른 새 세션의 에이전트가 변경을 비판적으로 읽고, 고칠 점이 있으면 구현으로 돌려보냅니다.",
     "expects": "변경은 통과하거나 지적과 함께 돌아가며, 지적된 실수는 에이전트의 기억에 규칙으로 남습니다."
    },
    {
     "place": "validate",
     "does": "검토를 통과한 변경을 디지털 쌍둥이 위에 올려, 명세 단계에서 곧장 건너온 시나리오로 만족도를 잽니다.",
     "expects": "검증에는 계획과 구현이 보지 못한 시나리오만 쓰였고, 기준을 넘었으면 판이 만들어져 있습니다."
    },
    {
     "place": "judge",
     "does": "사람이 검증을 통과한 판을 직접 써 보고 \"Is this lovable?\"을 물어 내보낼지 판정합니다.",
     "expects": "판정은 검증을 통과한 판에만 내려지며, 내보낼 판이 나오거나 아쉬운 점이 적혀 돌아갑니다."
    },
    {
     "place": ["factory", "customers"],
     "does": "공장에서 회사 전체로 나와, 사람이 판정한 판을 Software factory가 Customers에게 내보냅니다.",
     "expects": "고객 신호에서 시작한 문제가 사람의 판정을 거친 판으로 고객에게 전달되어 있습니다."
    }
   ]
  },
  {
   "slug": "run-agents-safely",
   "text": "공장의 에이전트가 구현하며 도구를 부르면, 권한 규칙이 허락한 호출만 실행되고 모든 호출이 기록에 남으며, 확인이 필요한 일 앞에서는 사람에게 묻습니다.",
   "walk": [
    {
     "place": ["builders", "factory"],
     "does": "사람이 명세와 시나리오를 Software factory에 넘기면서, 에이전트가 구현을 맡게 됩니다.",
     "expects": "공장에 구현할 일감이 맡겨져 있습니다."
    },
    {
     "place": "impl",
     "does": "Software factory 안을 열어, 여러 에이전트가 동시에 구현하는 Implementing 단계로 갑니다.",
     "expects": "구현이 여러 작업 공간으로 나뉘어 에이전트마다 실행 하나씩을 맡고 있습니다."
    },
    {
     "place": "queued",
     "does": "Implementing 안을 열어 실행 하나를 따라가면, 작업이 맡겨졌지만 아직 시작하지 않았습니다.",
     "expects": "실행이 대기 상태에 있고, 아직 아무 도구도 부르지 않았습니다."
    },
    {
     "place": "gather",
     "does": "에이전트가 작업을 집어 들고 필요한 파일, 문서, 이전 대화를 읽어 자료를 모읍니다.",
     "expects": "작업에 필요한 맥락이 모였고, 스킬은 필요한 것만 본문까지 읽혔습니다."
    },
    {
     "place": "act",
     "does": "에이전트가 도구를 부르기 시작하고, 하네스는 부르기 전에 권한 규칙부터 확인합니다.",
     "expects": "금지되지 않고 허용되었거나 확인을 받은 호출만 실행되었고, 그 호출은 감사 기록에 남았습니다."
    },
    {
     "place": "waiting",
     "does": "확인이 필요한 도구나 맡은 범위를 넘는 판단 앞에서, 에이전트가 멈추고 담당자에게 질문을 보냅니다.",
     "expects": "에이전트는 혼자 진행하지 않고 멈춰 있으며, 질문이 담당자에게 가 있습니다."
    },
    {
     "place": "act",
     "does": "담당자의 답을 받은 에이전트가 멈췄던 자리로 돌아와 다시 도구를 씁니다.",
     "expects": "답을 받은 뒤의 호출도 권한 규칙을 거쳐 실행되고, 하나도 빠짐없이 기록에 남습니다."
    },
    {
     "place": "verify",
     "does": "도구를 쓴 결과가 나오면 에이전트가 테스트를 돌리거나 결과를 다시 읽어 맞는지 확인합니다.",
     "expects": "변경이 확인을 통과했는지 판가름 났습니다."
    },
    {
     "place": "done",
     "does": "확인을 통과한 변경을 담당자에게 넘기고 실행을 끝냅니다.",
     "expects": "실행이 끝났고, 확인을 마친 변경이 담당자 손에 있습니다."
    },
    {
     "place": "impl",
     "does": "실행 하나에서 빠져나와 다시 Implementing 단계를 봅니다. 넘겨받은 변경이 다른 작업 공간의 결과와 모입니다.",
     "expects": "각 에이전트의 결과가 하나의 변경으로 모일 수 있습니다."
    },
    {
     "place": ["factory", "platform"],
     "does": "회사 전체로 나와 보면, 공장의 에이전트는 Platform의 실행 환경과 권한 규칙 위에서 돌아갑니다.",
     "expects": "방금 본 모든 도구 호출이 플랫폼이 운영하는 실행 환경을 거쳤습니다."
    },
    {
     "place": ["perm", "harness", "tools", "harness", "audit"],
     "does": "Platform 안을 열면, Permissions가 Harness의 호출을 거르고, Harness가 MCP tool을 부르며 그 호출을 Audit log에 적습니다.",
     "expects": "권한 규칙이 허락한 호출만 실행되고 모든 호출이 감사 기록에 남아, 누가 무엇을 했는지 따라갈 수 있습니다."
    }
   ]
  },
  {
   "slug": "ask-the-brain",
   "text": "에이전트가 일을 시작하며 맥락이 필요하면 회사의 기억에 묻고, 자기가 볼 수 있는 결정과 그 이유만 받아 씁니다.",
   "walk": [
    {
     "place": ["builders", "factory"],
     "does": "사람이 명세와 시나리오를 Software factory에 넘겨, 에이전트가 맡을 일이 생깁니다.",
     "expects": "공장에 구현할 일감이 맡겨져 있습니다."
    },
    {
     "place": "impl",
     "does": "Software factory 안의 Implementing 단계로 들어가, 에이전트 하나가 일을 시작하려는 순간을 봅니다.",
     "expects": "에이전트가 작업을 맡았고, 시작하려면 맥락이 필요합니다."
    },
    {
     "place": "gather",
     "does": "실행 안을 열어 보면, 에이전트가 작업에 필요한 파일, 문서, 이전 결정을 모으고 있습니다.",
     "expects": "에이전트가 무엇을 알아야 하는지 정해졌고, 회사의 기억에 물을 질문이 생겼습니다."
    },
    {
     "place": "impl",
     "does": "실행에서 빠져나와 Implementing으로 돌아가, 에이전트의 질문이 공장 밖으로 향하는 길을 따라갑니다.",
     "expects": "질문은 이 에이전트가 맡은 작업의 이름으로 회사의 기억에 갈 준비가 되어 있습니다."
    },
    {
     "place": ["factory", "builders", "brain"],
     "does": "회사 전체로 나와 보면, Software factory와 Builders가 함께 쓰는 Company brain에 에이전트가 질문을 보냅니다.",
     "expects": "회사의 기억은 묻는 에이전트가 원래 자리에서 볼 수 있는 것만 골라 돌려줍니다."
    },
    {
     "place": ["work", "rem", "mem"],
     "does": "Company brain 안을 열면, Work record와 Agent memory가 모두 Remembered로서 출처, 볼 수 있는 범위, 이유를 함께 지닙니다.",
     "expects": "에이전트는 볼 권한이 있는 결정과 그 이유만 받아, 회의에 없었어도 왜 그렇게 되었는지 알고 일합니다."
    }
   ]
  },
  {
   "slug": "learn-from-mistakes",
   "text": "검토에서 실수가 지적되면 그것이 에이전트의 규칙과 평가 과제가 되고, 스킬을 고친 뒤 평가 점수가 떨어지지 않아야 반영됩니다.",
   "walk": [
    {
     "place": ["builders", "factory"],
     "does": "사람이 명세와 시나리오를 Software factory에 넘겨, 에이전트가 만든 변경이 검토를 기다립니다.",
     "expects": "공장에 검토할 변경이 있습니다."
    },
    {
     "place": "review",
     "does": "Software factory 안의 Reviewing 단계에서, 새 세션의 에이전트가 변경을 읽다가 실수를 찾아냅니다.",
     "expects": "지적한 실수가 같은 자리에서 에이전트의 기억에 규칙 한 줄로 더해졌습니다."
    },
    {
     "place": "impl",
     "does": "지적을 들고 Implementing으로 돌아가, 에이전트가 새 규칙을 읽고 변경을 고칩니다.",
     "expects": "고친 변경에 같은 실수가 남아 있지 않습니다."
    },
    {
     "place": "review",
     "does": "고친 변경이 다시 Reviewing으로 와서, 새 세션이 한 번 더 비판적으로 읽습니다.",
     "expects": "변경이 이번에는 통과하거나, 남은 지적과 함께 다시 돌아갑니다."
    },
    {
     "place": ["factory", "platform"],
     "does": "회사 전체로 나와 보면, 공장의 에이전트가 기대는 스킬과 평가는 Platform이 운영합니다.",
     "expects": "검토에서 쌓인 지적이 플랫폼으로 넘어가 스킬을 고칠 재료가 되어 있습니다."
    },
    {
     "place": ["evals", "skills"],
     "does": "Platform 안을 열면, 지적된 실패가 Evals에 과제로 더해지고, 고친 Skill은 그 묶음으로 점수를 잽니다.",
     "expects": "평가 점수가 떨어지지 않은 스킬만 반영되어, 한 번 고친 실패가 조용히 되돌아오지 않습니다."
    }
   ]
  },
  {
   "slug": "set-ai-bar",
   "text": "경영진이 AI 사용을 기본 기대치로 정하면, 그 기준이 자리를 여는 요청, 채용, 온보딩, 성과 평가에 차례로 적용되고, 모든 사람이 직접 만드는 사람으로 일합니다.",
   "walk": [
    {
     "place": "lead",
     "does": "Leadership이 AI를 얼마나, 어떻게 쓰기를 기대하는지 정하면서 이야기가 시작됩니다.",
     "expects": "경영진이 정한 AI 사용 기대치가 회사의 기준으로 서 있고, 채용, 평가, 예산에 묶여 있습니다."
    },
    {
     "place": "opening",
     "does": "그 기준이 실제로 쓰이는 흐름 안으로 들어가면, 첫 자리는 팀이 사람을 더 뽑으려고 자리를 요청하는 일입니다.",
     "expects": "요청에는 그 일을 에이전트에게 맡겨 보았지만 사람에게 물어야 했던 실행이 증거로 붙어 있습니다."
    },
    {
     "place": "hiring",
     "does": "승인된 자리로 후보자를 뽑으면서 AI를 다루는 역량을 함께 봅니다.",
     "expects": "AI 역량을 확인받은 사람이 뽑혀 있습니다."
    },
    {
     "place": "onboarding",
     "does": "새로 온 사람이 첫 주 안에 AI 코딩 도구와 에이전트 환경을 갖춥니다.",
     "expects": "새 사람이 첫 주 안에 도구와 에이전트 환경을 쓸 수 있습니다."
    },
    {
     "place": "perf",
     "does": "일하며 쌓인 기록을 재료로, 평가에서 AI를 얼마나 잘 썼는지를 함께 봅니다.",
     "expects": "AI 활용이 평가에 반영되어 있고, 기대치에 못 미치면 다시 익힐 계획이 정해집니다."
    },
    {
     "place": ["lead", "builders"],
     "does": "회사 전체로 나와 보면, Leadership이 정한 기준이 Builders 모두가 일하는 방식의 바탕이 되어 있습니다.",
     "expects": "채용부터 평가까지 같은 AI 기대치가 적용되어 회사의 모든 사람에게 닿아 있습니다."
    },
    {
     "place": ["ic", "agent", "ic", "handson", "dri", "handson", "coach"],
     "does": "Builders 안을 열면, IC, DRI, player-coach 세 역할이 모두 Hands-on이고, IC가 부모로 Agent를 책임집니다.",
     "expects": "누구도 관리만 하지 않고 모두 직접 만들고 내보내며, 에이전트마다 책임지는 사람이 한 명 있습니다."
    }
   ]
  },
  {
   "slug": "own-a-problem",
   "text": "DRI가 문제 하나를 맡으면 여러 팀의 IC를 끌어와 함께 풀고, 그 IC가 부모로 책임지는 에이전트도 함께 일합니다.",
   "walk": [
    {
     "place": ["handson", "dri", "ic", "agent"],
     "does": "DRI가 문제 하나를 맡아 여러 팀에서 IC를 끌어오고, 그 IC가 부모로 책임지는 Agent도 함께 일합니다. DRI와 IC는 모두 Hands-on입니다.",
     "expects": "문제마다 정해진 기간 동안 고객 결과를 책임지는 DRI가 한 명 있고, 함께 일하는 에이전트마다 책임지는 IC가 한 명 있습니다."
    }
   ]
  },
  {
   "slug": "coach-while-building",
   "text": "player-coach는 직접 만들면서 함께 일하는 IC를 키웁니다.",
   "walk": [
    {
     "place": ["coach", "ic", "handson", "coach"],
     "does": "player-coach가 직접 만들면서 함께 일하는 IC에게 맥락을 주고 기준을 높여 키웁니다. 두 사람 모두 Hands-on입니다.",
     "expects": "player-coach도 관리만 하지 않고 직접 만들고 내보내며, 함께한 IC가 그 과정에서 자랍니다."
    }
   ]
  },
  {
   "slug": "turn-signal-into-problem",
   "text": "고객 신호가 기존 기능으로 풀리지 않으면 새 문제로 기억에 남습니다.",
   "walk": [
    {
     "place": ["rem", "signal", "problem", "rem"],
     "does": "기존 기능을 엮어서는 풀 수 없는 Customer signal이 새 Problem이 됩니다. 신호도 문제도 Remembered로서 기억에 들어갑니다.",
     "expects": "새 문제가 출처와 볼 수 있는 범위와 함께 기억에 남아, 고객 신호에서 나온 할 일이 되어 있습니다."
    }
   ]
  },
  {
   "slug": "keep-the-reasons",
   "text": "결정과 명세는 이유와 함께 기억에 남고, 에이전트의 규칙도 같은 기억에 쌓입니다.",
   "walk": [
    {
     "place": ["work", "rem", "mem"],